{
  "schema_version": "1.0",
  "preset_id": "structure",
  "headline": "预算已平衡，其他安排需要持续跟踪",
  "summary": "经销商分配与其他预算安排分开展示，金额找平不等于全部到经销商。",
  "blocks": [
    {
      "id": "mix-view",
      "kind": "visual",
      "title": "预算安排的去向",
      "body": "其他预算安排35,036，需要后续落实用途。",
      "status": "observed",
      "dimension_ids": [
        "completeness"
      ],
      "fact_ids": [
        "budget",
        "allocated",
        "other"
      ],
      "dataset_id": "budget-mix"
    },
    {
      "id": "rank-view",
      "kind": "visual",
      "title": "讨论对象的投入规模",
      "body": "占比只陈述集中度，不把排序当作异常阈值。",
      "status": "observed",
      "dimension_ids": [
        "concentration",
        "overlap"
      ],
      "fact_ids": [
        "top-plan",
        "low-plan",
        "high-plan",
        "allocated"
      ],
      "dataset_id": "top-dealers"
    }
  ],
  "checks": [
    {
      "dimension_id": "low_yield",
      "status": "observed",
      "summary": "1100 历史Yield为6.29，计划投入51,000。",
      "fact_ids": [
        "low-yield",
        "low-plan",
        "target"
      ]
    },
    {
      "dimension_id": "high_yield",
      "status": "observed",
      "summary": "800 历史Yield为25.67，计划投入53,000。",
      "fact_ids": [
        "high-yield",
        "high-plan",
        "target"
      ]
    },
    {
      "dimension_id": "concentration",
      "status": "observed",
      "summary": "900 占经销商分配4.77%；未提供异常阈值。",
      "fact_ids": [
        "top-share",
        "rules"
      ]
    },
    {
      "dimension_id": "overlap",
      "status": "observed",
      "summary": "57家涉及多项安排；叠加本身不代表重复投入。",
      "fact_ids": [
        "overlap",
        "top-overlap"
      ]
    },
    {
      "dimension_id": "trend",
      "status": "review",
      "summary": "900 的计划增幅与历史表现需要结合业务目标解释。",
      "fact_ids": [
        "top-growth",
        "vol",
        "c3",
        "target"
      ]
    },
    {
      "dimension_id": "completeness",
      "status": "clear",
      "summary": "金额已平衡；其他安排35,036仍需落实用途。",
      "fact_ids": [
        "budget",
        "allocated",
        "other",
        "gap"
      ]
    }
  ],
  "limitations": [
    "仅使用本次授权证据；没有2027经营预测，不推断未来收益或因果。"
  ]
}
