{
  "schema_version": "1.0",
  "preset_id": "comprehensive",
  "headline": "900 计划投入增长与历史经营变化值得一并查看",
  "summary": "预算金额已平衡；未来投入与历史表现需要一起解释。",
  "blocks": [
    {
      "id": "focus-900",
      "kind": "finding",
      "title": "900：计划投入明显高于历史参考",
      "body": "2027计划92,000，相比2025实际30,000增加206.67%；同期口径的历史Vol与C3同比均下降。建议补充2027目标和投放用途，再判断投入是否匹配。",
      "status": "review",
      "dimension_ids": [
        "trend"
      ],
      "fact_ids": [
        "top-plan",
        "top-history",
        "top-growth",
        "vol",
        "c3"
      ],
      "dataset_id": "900-compare"
    },
    {
      "id": "yield-context",
      "kind": "note",
      "title": "Yield 保留为观察线索",
      "body": "现有高低排名不足以证明投入过多或不足。",
      "status": "observed",
      "dimension_ids": [
        "low_yield",
        "high_yield"
      ],
      "fact_ids": [
        "low-yield",
        "high-yield",
        "target"
      ],
      "dataset_id": null
    }
  ],
  "checks": [
    {
      "dimension_id": "low_yield",
      "status": "observed",
      "summary": "1100 历史Yield为6.29，计划投入51,000。",
      "fact_ids": [
        "low-yield",
        "low-plan",
        "target"
      ]
    },
    {
      "dimension_id": "high_yield",
      "status": "observed",
      "summary": "800 历史Yield为25.67，计划投入53,000。",
      "fact_ids": [
        "high-yield",
        "high-plan",
        "target"
      ]
    },
    {
      "dimension_id": "concentration",
      "status": "observed",
      "summary": "900 占经销商分配4.77%；未提供异常阈值。",
      "fact_ids": [
        "top-share",
        "rules"
      ]
    },
    {
      "dimension_id": "overlap",
      "status": "observed",
      "summary": "57家涉及多项安排；叠加本身不代表重复投入。",
      "fact_ids": [
        "overlap",
        "top-overlap"
      ]
    },
    {
      "dimension_id": "trend",
      "status": "review",
      "summary": "900 的计划增幅与历史表现需要结合业务目标解释。",
      "fact_ids": [
        "top-growth",
        "vol",
        "c3",
        "target"
      ]
    },
    {
      "dimension_id": "completeness",
      "status": "clear",
      "summary": "金额已平衡；其他安排35,036仍需落实用途。",
      "fact_ids": [
        "budget",
        "allocated",
        "other",
        "gap"
      ]
    }
  ],
  "limitations": [
    "仅使用本次授权证据；没有2027经营预测，不推断未来收益或因果。"
  ]
}
